dinhDanh,nhanHienThi,moTa
Viet_Nam,Việt nam ,"Mỹ – Hợp chúng quốc Hoa Kỳ là một cộng hòa lập hiến liên bang gồm có 50 tiểu bang và một đặc khu liên bang. Hoa Kỳ cũng có 14 lãnh thổ hay còn được gọi là vùng quốc hải rải rác trong vùng biển Caribbean và Thái Bình Dương. Hoa Kỳ là quốc gia lớn hạng ba về diện tích và hạng ba về dân số trên thế giới. Hoa Kỳ là một trong những quốc gia đa dạng chủng tộc nhất trên thế giới, do kết quả của những cuộc di dân đến từ nhiều quốc gia khác trên thế giới. Hoa Kỳ được nhiều quốc gia nhìn nhận như là một thế lực quân sự, văn hoá, và kinh tế có ảnh hưởng lớn nhất trên thế giới."
My,Mỹ,"Nước Cộng hòa Xã hội Chủ nghĩa Việt Nam là quốc gia nằm ở cực đông của bán đảo Đông Dương, thuộc khu vực Đông Nam Á. Với khoảng 90,5 triệu dân (năm 2014), Việt Nam là quốc gia đông dân thứ 13 thế giới và là quốc gia đông dân thứ 8 tại châu Á. Thủ đô là Hà Nội từ năm 1976, với Thành phố Hồ Chí Minh là thành phố lớn nhất về kinh tế và đông dân nhất. Việt Nam thiết lập quan hệ ngoại giao với 188 quốc gia và là thành viên của Liên Hiệp Quốc (năm 1977), ASEAN (năm 1995), WTO (2007), Phong trào không liên kết (năm 1976), cùng các tổ chức quốc tế khác"
Trung_Quoc,Trung Quốc," Trung Quốc là một quốc gia có chủ quyền nằm tại Đông Á. Đây là quốc gia đông dân nhất thế giới, với số dân trên 1,405 tỷ người. Trung Quốc là quốc gia đơn đảng do Đảng Cộng sản Trung Quốc nắm quyền, chính phủ trung ương đặt tại thủ đô Bắc Kinh.Trung Quốc là quốc gia có diện tích lục địa lớn thứ tư trên thế giới. Kinh tế Trung Quốc đứng thứ hai thế giới Trung Quốc được công nhận là một quốc gia sở hữu vũ khí hạt nhân và có quân đội thường trực lớn nhất thế giới .Có tầm ảnh hưởng mạnh mẽ văn hóa , kinh tế , chính trị , quân sự với khu vực Châu Á ."
Phap,Phap," là một quốc gia có lãnh thổ chính nằm tại Tây Âu cùng một số vùng và lãnh thổ hải ngoại.Pháp từ lâu đã có vị thế là một trung tâm của thế giới về nghệ thuật, khoa học và triết học. Pháp có số di sản thế giới UNESCO nhiều thứ ba tại châu Âu, . Pháp là một quốc gia phát triển, có nền kinh tế lớn thứ sáu thế giới .Về tổng tài sản gia đình, Pháp xếp hạng tư trên thế giới. Pháp có thành tích cao trong các xếp hạng quốc tế về giáo dục, y tế, tuổi thọ dự tính, và phát triển con người. Pháp duy trì vị thế đại cường quốc trên thế giới, là một trong năm thành viên thường trực trong Hội đồng Bảo an Liên Hiệp Quốc"
Nhat_Ban,Nhat_Ban,"Nhật Bản là một đảo quốc nằm ở vùng Đông Á. Tọa lạc trên Thái Bình Dương, nước này nằm bên rìa phía đông của Biển Nhật Bản, Biển Hoa Đông, Trung Quốc, bán đảo Triều Tiên.Có nền văn hóa đa dạng phong phú . Dân số Nhật bản khoảng 126 triệu dân .Nhật Bản là nước thành viên của Liên Hợp Quốc, khối APEC, các nhóm G7, G8 và G20, đồng thời được xem như một cường quốc.Quốc gia này có nền kinh tế đứng hạng ba thế giới.Nhật Bản là một nước phát triển với mức sống và Chỉ số phát triển con người rất cao, trong đó người dân được hưởng tuổi thọ cao nhất thế giới,"
Indonesia,Indonesia,"Indonesia là một đảo quốc lục địa nằm giữa Đông Nam Á và Châu Đại Dương. Indonesia được mệnh danh là ""Xứ sở vạn đảo"", lãnh thổ của nó bao gồm 13.487 hòn đảo[3][4] và với dân số hơn 260 triệu người .Indonesia là quốc gia có số dân theo Hồi giáo đông nhất thế giới.Dù có dân số lớn và nhiều vùng đông đúc, Indonesia vẫn có nhiều khu vực hoang vu và là quốc gia có mức độ đa dạng sinh học đứng hàng thứ hai thế giới. Nước này rất giàu các nguồn tài nguyên thiên nhiên, có một lãnh thổ rộng nhất trong các nước Đông Nam Á, tuy vậy sự nghèo khó vẫn là một đặc điểm của Indonesia hiện đại"
